{
  "eventId": "11111111-1111-4111-8111-111111111113", "eventType": "workflow.started", "schemaVersion": 1,
  "tenantId": "tenant-byd", "correlationId": "corr-m17", "causationId": "11111111-1111-4111-8111-111111111111",
  "aggregateType": "Workflow", "aggregateId": "55555555-5555-4555-8555-555555555555", "aggregateVersion": 1,
  "occurredAt": "2026-07-14T01:00:01Z",
  "payload": {
    "workflowInstanceId": "55555555-5555-4555-8555-555555555555", "projectId": "33333333-3333-4333-8333-333333333333",
    "workOrderId": "22222222-2222-4222-8222-222222222222", "configurationBundleId": "44444444-4444-4444-8444-444444444444",
    "workflowDefinitionVersionId": "66666666-6666-4666-8666-666666666666", "workflowKey": "byd.survey-install",
    "workflowVersion": "1.0.0", "definitionDigest": "bbbbbbbbbbbbbbbbbbbbbbbbbbbbbbbbbbbbbbbbbbbbbbbbbbbbbbbbbbbbbbbb",
    "startedAt": "2026-07-14T01:00:01Z"
  }
}
